1,vanilla ice cream,2.99,true,1,123,"Delicious vanilla ice cream.","https://example.com/vanilla_ice_cream.jpg","Food & Beverage"
2,chocolate ice cream,2.99,true,1,321,"Rich chocolate ice cream.","https://example.com/chocolate_ice_cream.jpg","Food & Beverage"
3,strawberry ice cream,2.99,true,1,888,"Fresh strawberry ice cream.","https://example.com/strawberry_ice_cream.jpg","Food & Beverage"
4,6-pack of paycheck pilsners,11.49,true,1,123,"6-pack of refreshing paycheck pilsners.","https://example.com/pilsner.jpg","Food & Beverage"
5,seven fabergé easter eggs,1199000.00,true,1,35325,"Luxurious Fabergé Easter eggs.","https://example.com/faberge_eggs.jpg","Sports & Outdoors"
6,painting - storm at galilee,44000000.00,true,1,12389,"Historic painting - The Storm at Galilee.","https://example.com/storm_galilee.jpg","Sports & Outdoors"
100,i love nyc mug,12.99,true,1,25,"Classic I Love NYC mug.","https://example.com/i_love_nyc_mug.jpg","Home & Kitchen"
101,i love paris mug,12.99,true,1,15,"Classic I Love Paris mug.","https://example.com/i_love_paris_mug.jpg","Home & Kitchen"
102,i love rome mug,12.99,true,1,11,"Classic I Love Rome mug.","https://example.com/i_love_rome_mug.jpg","Home & Kitchen"
